Tag_Category,Line_Number,Matched_Text,Context
QUESTION_Q6_CommunityDifferences,1180,challenge,"re's not, like, adequate ones. So it's an ongoing challenge, you know, just trying to think about what is all"
QUESTION_Q6_CommunityDifferences,292,difficult," pushback, and so the first blush is that they're difficult to work with. No, they live there, they're apprec"
QUESTION_Q6_CommunityDifferences,1309,barrier,"Anna Sattler: But it's located on a barrier reef, like several of those communities are, and "
QUESTION_Q7_LeadershipEngagement,1246,tribal leader,"to you, they're looking to you as a community and tribal leader as well, and thinking about, like, what they can "
QUESTION_Q7_LeadershipEngagement,229,council,"Anna Sattler: all of the board members and council members, and that we get their buy-in, because wh"
QUESTION_Q7_LeadershipEngagement,229,board,"Anna Sattler: all of the board members and council members, and that we get thei"
QUESTION_Q7_LeadershipEngagement,418,board," delegates from, our communities come in with our board of directors to meet. And so there… there's share"
QUESTION_Q7_LeadershipEngagement,664,board,"nts. I want to make sure that, you know, the… the board is elected by its members."
QUESTION_Q7_LeadershipEngagement,670,board,"erative governance, right? We have a seven-member board,"
QUESTION_Q7_LeadershipEngagement,778,board,"mbers of the cooperative eligible to serve on the board, or…"
QUESTION_Q7_LeadershipEngagement,787,board,"Anna Sattler: AVAC to even run for the board, and board members are elected by the members."
QUESTION_Q7_LeadershipEngagement,787,board,"Anna Sattler: AVAC to even run for the board, and board members are elected by the members."
QUESTION_Q7_LeadershipEngagement,808,board,"Anna Sattler: the AVAC board? Correct. Or, like, the… like, in each community,"
QUESTION_Q7_LeadershipEngagement,820,board,"Anna Sattler: Yeah, the… like, the board, gets a stipend for, you know, their meetings, an"
QUESTION_Q7_LeadershipEngagement,406,communicate," values, and, you know, we do that by just how we communicate and how we work with… with each, of the… our comm"
QUESTION_Q7_LeadershipEngagement,604,communicate,"ire… excuse me, some cell phone towers to, to… to communicate those different things. So that is… that is impor"
QUESTION_Q7_LeadershipEngagement,742,communicate,"nna Sattler: is the for-profit, you know, arm. We communicate with the leadership of all three entities."
QUESTION_Q7_LeadershipEngagement,409,meeting,"ttler: And a chairperson, and they host an annual meeting in each one of their communities."
QUESTION_Q7_LeadershipEngagement,415,meeting,elegate is… comes to Anchorage for the big annual meeting.
QUESTION_Q7_LeadershipEngagement,823,meeting,"son, and then the delegate, they get a very small meeting fee, to coordinate the meeting, and then our offi"
QUESTION_Q7_LeadershipEngagement,823,meeting,"y get a very small meeting fee, to coordinate the meeting, and then our office, Member Services, sends them"
QUESTION_Q7_LeadershipEngagement,829,meeting,"o every chairman, and then help them coordinate a meeting,"
QUESTION_Q7_LeadershipEngagement,832,meeting,ligible to send a delegate to the… the big annual meeting in… in… in Anchorage.
QUESTION_Q7_LeadershipEngagement,835,meeting,"ir only duty is to… to get… to ensure a community meeting every year, but they are compensated a tiny bit."
QUESTION_Q7_LeadershipEngagement,1030,meeting, to integrate those kinds of things so that we're meeting their goals.
QUESTION_Q7_LeadershipEngagement,1033,meeting,"Anna Sattler: But we're also meeting AVAC goals, so just a lot of community collaborat"
QUESTION_Q7_LeadershipEngagement,1567,meeting,"and the community. So, Anna, it's been a pleasure meeting you."
QUESTION_Q7_LeadershipEngagement,1570,meeting,"Anna Sattler: It's a pleasure meeting you both, too. I want to… I have a little brag. M"
QUESTION_Q8_Success,952,success,Anna Sattler: we have a couple of really good success stories. One of them is… is Stebbins and St. Mich
QUESTION_Q8_Success,1255,grow,hey stay the same? Should they… are they going to grow in different ways that you can anticipate? What d
QUESTION_Q8_Success,1525,grow,"roup of women on Oneida Reservation. They have to grow the corn differently, their white corn."
QUESTION_Q8_Success,742,profit,"Anna Sattler: is the for-profit, you know, arm. We communicate with the leadershi"
QUESTION_Q8_Success,1051,impact,"shia: So, speaking of that, what do you think the impact of COVID was? And so, as we're thinking about, li"
QUESTION_Q8_Success,1339,impact," Sattler: So, and then, you know, that… that will impact how we do business, because everything, like, pol"
QUESTION_Q9_COVID,25,COVID,", we've just, you know, we're like, oh, okay, and COVID forced us to, like, use these things, and so this"
QUESTION_Q9_COVID,1051,COVID,"speaking of that, what do you think the impact of COVID was? And so, as we're thinking about, like."
QUESTION_Q9_COVID,1057,COVID,"g or something, like, well, everybody experienced COVID, correct, everybody did experience COVID, but we "
QUESTION_Q9_COVID,1057,COVID,"erienced COVID, correct, everybody did experience COVID, but we experienced it differently. I remember, l"
QUESTION_Q9_COVID,1060,COVID," in thinking about all those different impacts of COVID. Like, what did that do?"
QUESTION_Q9_COVID,1126,COVID,"Anna Sattler: you know, for COVID travel and those kinds of things."
QUESTION_Q9_COVID,1054,pandemic,"Jodi Burshia: how this global pandemic impacted so many, you know, almost everyone, you "
QUESTION_Q9_COVID,1087,pandemic,"ally, transportation costs went way up during the pandemic."
